{"assignments":{"number_of_devs":{"attributes":["number_of_vcs_devs","number_of_jira_devs","number_of_seats"],"expression":"number_of_devs=where(number_of_vcs_devs > 0, number_of_vcs_devs, mean(number_of_jira_devs, number_of_seats))"}},"weighted":true,"stratified":false,"features":["sprint_days","num_story_points","num_weighted_points","num_links","num_comments","avg_concurrent_progress","number_of_devs"],"binary":null,"model":"abe","label":{"expression":"round(done_story_points)","attributes":["done_story_points"]},"metadata":["project_id","sprint_id"]}
